{
  "schemaVersion": "1.0.0",
  "id": "example.migrated",
  "name": "Migrated from 1.0.0",
  "pluginRequirements": [],
  "workspace": {
    "variables": [
      {
        "key": "title",
        "schema": { "type": "string" },
        "defaultValue": {
          "kind": "public_literal",
          "dataType": "string",
          "value": "Hello"
        },
        "const": false,
        "exposure": "clientVisible"
      }
    ]
  },
  "bits": [
    {
      "id": "b1",
      "type": "roborean.noop",
      "when": true,
      "config": {},
      "reads": [],
      "writes": [],
      "emits": [],
      "effectClass": "pure",
      "onError": "abort",
      "capabilities": []
    }
  ],
  "documents": [],
  "templates": [],
  "metadata": {}
}
